{
  "$schema": "https://asdm.dev/schemas/lock.schema.json",
  "synced_at": "2026-03-31T14:22:00Z",
  "cli_version": "0.1.0",
  "manifest_version": "1.0.0",
  "manifest_commit": "a1b2c3d4e5f6789",
  "registry": "github://company/asdm-registry",
  "profile": "fullstack-engineer",
  "resolved_profiles": ["base", "fullstack-engineer"],
  "files": {
    ".opencode/agents/code-reviewer.md": {
      "sha256": "abc123def456abc123def456abc123def456abc123def456abc123def456abc1",
      "source": "agents/code-reviewer.md",
      "adapter": "opencode",
      "version": "1.3.0",
      "managed": true
    }
  }
}
